<?xml version="1.0" encoding="utf-8"?><MapChitData      xmlns:xsd="http://www.w3.org/2001/XMLSchema"       xmlns:xsi="http://www.w3.org/2001/XMLSchema-instance"          xsi:noNamespaceSchemaLocation="MapChits.xsd">     <SoundChits>        <SoundChit>            <Name>Flutter</Name>            <Clearing>1</Clearing>        </SoundChit>        <SoundChit>            <Name>Flutter</Name>            <Clearing>2</Clearing>        </SoundChit>        <SoundChit>            <Name>Howl</Name>            <Clearing>4</Clearing>        </SoundChit>        <SoundChit>            <Name>Howl</Name>            <Clearing>5</Clearing>        </SoundChit>        <SoundChit>            <Name>Patter</Name>            <Clearing>2</Clearing>        </SoundChit>        <SoundChit>            <Name>Patter</Name>            <Clearing>5</Clearing>        </SoundChit>        <SoundChit>            <Name>Roar</Name>            <Clearing>4</Clearing>        </SoundChit>        <SoundChit>            <Name>Roar</Name>            <Clearing>6</Clearing>        </SoundChit>        <SoundChit>            <Name>Slither</Name>            <Clearing>3</Clearing>        </SoundChit>        <SoundChit>            <Name>Slither</Name>            <Clearing>6</Clearing>        </SoundChit>    </SoundChits>    <WarningChits>        <WarningChit>            <Name>Bones</Name>        </WarningChit>        <WarningChit>            <Name>Dank</Name>        </WarningChit>        <WarningChit>            <Name>Ruins</Name>        </WarningChit>        <WarningChit>            <Name>Smoke</Name>        </WarningChit>        <WarningChit>            <Name>Stink</Name>        </WarningChit>    </WarningChits>        <TreasureSiteChits>        <TreasureSiteChit>            <Name>Altar</Name>            <Clearing>1</Clearing>            <SmallTreasures>0</SmallTreasures>            <LargeTreasures>4</LargeTreasures>            <Monster>Demon</Monster>            <MonsterRoll>2</MonsterRoll>        </TreasureSiteChit>        <TreasureSiteChit>            <Name>Cairns</Name>            <Clearing>5</Clearing>            <SmallTreasures>6</SmallTreasures>            <LargeTreasures>1</LargeTreasures>            <Monster>T Spider</Monster>            <MonsterRoll>5</MonsterRoll>        </TreasureSiteChit>        <TreasureSiteChit>            <Name>Hoard</Name>            <Clearing>6</Clearing>            <SmallTreasures>4</SmallTreasures>            <LargeTreasures>5</LargeTreasures>            <Monster>T Flying Dragon</Monster>            <MonsterRoll>1</MonsterRoll>        </TreasureSiteChit>        <TreasureSiteChit>            <Name>Lair</Name>            <Clearing>3</Clearing>            <SmallTreasures>4</SmallTreasures>            <LargeTreasures>3</LargeTreasures>            <Monster>T Dragon</Monster>            <MonsterRoll>1</MonsterRoll>        </TreasureSiteChit>        <TreasureSiteChit>            <Name>Pool</Name>            <Clearing>6</Clearing>            <SmallTreasures>6</SmallTreasures>            <LargeTreasures>3</LargeTreasures>            <Monster>Octopus</Monster>            <MonsterRoll>3</MonsterRoll>        </TreasureSiteChit>        <TreasureSiteChit>            <Name>Shrine</Name>            <Clearing>4</Clearing>            <SmallTreasures>2</SmallTreasures>            <LargeTreasures>2</LargeTreasures>            <Monster>Winged Demon</Monster>            <MonsterRoll>2</MonsterRoll>        </TreasureSiteChit>        <TreasureSiteChit>            <Name>Statue</Name>            <Clearing>2</Clearing>            <SmallTreasures>2</SmallTreasures>            <LargeTreasures>1</LargeTreasures>            <Monster>Imp</Monster>            <MonsterRoll>5</MonsterRoll>        </TreasureSiteChit>        <TreasureSiteChit>            <Name>Vault</Name>            <Clearing>3</Clearing>            <SmallTreasures>0</SmallTreasures>            <LargeTreasures>5</LargeTreasures>            <Monster>T Troll</Monster>            <MonsterRoll>4</MonsterRoll>        </TreasureSiteChit>    </TreasureSiteChits>    <SiteAndSoundChitLocations>        <SiteAndSoundChitLocation>            <TileType>C</TileType>            <SiteAndSoundChits>4</SiteAndSoundChits>            <SubstituteChitRef>LostCity</SubstituteChitRef>        </SiteAndSoundChitLocation>        <SiteAndSoundChitLocation>            <TileType>M</TileType>            <SiteAndSoundChits>4</SiteAndSoundChits>            <SubstituteChitRef>LostCastle</SubstituteChitRef>        </SiteAndSoundChitLocation>        <SiteAndSoundChitLocation>            <SubstituteChitType>LostCity</SubstituteChitType>            <SiteAndSoundChits>5</SiteAndSoundChits>        </SiteAndSoundChitLocation>        <SiteAndSoundChitLocation>            <SubstituteChitType>LostCastle</SubstituteChitType>            <SiteAndSoundChits>5</SiteAndSoundChits>        </SiteAndSoundChitLocation>    </SiteAndSoundChitLocations>    <DwellingDataList>        <DwellingData>          <Name>Chapel</Name>          <MapChit type="V">Dank</MapChit>        </DwellingData>        <DwellingData>          <Name>Ghost Clearing</Name>          <MapChit type="V">Bones</MapChit>        </DwellingData>        <DwellingData>          <Name>Guardhouse</Name>          <MapChit type="V">Ruins</MapChit>        </DwellingData>        <DwellingData>          <Name>House</Name>          <MapChit type="V">Smoke</MapChit>        </DwellingData>        <DwellingData>          <Name>Inn</Name>          <MapChit type="V">Stink</MapChit>        </DwellingData>        <DwellingData>          <Name>Large Campfire</Name>          <MapChit type="W">Stink</MapChit>        </DwellingData>        <DwellingData>          <Name>Small Campfire</Name>          <MapChit type="W">Smoke</MapChit>        </DwellingData>    </DwellingDataList>        <VisitorMissionCampaignChits>        <VisitorMissionCampaignChit>                <Visitor>Shaman</Visitor>                <Mission>Escort Party</Mission>        </VisitorMissionCampaignChit>            <VisitorMissionCampaignChit>                <Visitor>Warlock</Visitor>                <Mission>Food/Ale</Mission>        </VisitorMissionCampaignChit>        <VisitorMissionCampaignChit>                <Visitor>Crone</Visitor>                <Campaign>Raid</Campaign>        </VisitorMissionCampaignChit>        <VisitorMissionCampaignChit>                <Visitor>Scholar</Visitor>                <Campaign>Pilliage</Campaign>        </VisitorMissionCampaignChit>        <VisitorMissionCampaignChit>                <Campaign>Conquer</Campaign>                <Campaign>War</Campaign>        </VisitorMissionCampaignChit>        <VisitorMissionCampaignChit>                <Campaign>Revolt</Campaign>                <Campaign>Quest</Campaign>        </VisitorMissionCampaignChit>    </VisitorMissionCampaignChits></MapChitData>